{
  "schema_version": 2,
  "eval_version": "w13-eval-v2-dev",
  "contract_status": "confirmed",
  "corpus_snapshot_id": "technical-9c6e6549b991",
  "split": "dev",
  "items": [
    {
      "id": "w13-v2-dev-01",
      "behavior_type": "document_identity",
      "query": "在 LangChain Document 映射中，正文、来源身份和内容 hash 分别承担什么职责？",
      "expected_branch": "answered",
      "expected_rule_conclusion": "page_content 承载正文，metadata 承载来源身份与 hash；正式判据待确认。",
      "evidence_requirements": [
        {
          "kind": "diagnostic_fixture",
          "fixture_id": "document-identity-01",
          "observables": [
            "page_content",
            "metadata.source_id",
            "metadata.content_sha256"
          ],
          "requirement": "验证 page_content 与 metadata.source_id/content_sha256 的映射一致。"
        }
      ]
    },
    {
      "id": "w13-v2-dev-02",
      "behavior_type": "document_identity",
      "query": "两份正文完全相同的文档如何保持可区分的来源身份并避免引用串文档？",
      "expected_branch": "answered",
      "expected_rule_conclusion": "使用稳定且唯一的 source_id/来源范围，正文相同不能作为身份；正式判据待确认。",
      "evidence_requirements": [
        {
          "kind": "diagnostic_fixture",
          "fixture_id": "document-identity-02",
          "observables": [
            "duplicate.page_content",
            "distinct.metadata.source_id",
            "citation.lookup"
          ],
          "requirement": "验证正文可相同但 source_id 必须不同且可独立定位。"
        }
      ]
    },
    {
      "id": "w13-v2-dev-03",
      "behavior_type": "retrieval",
      "query": "retrieval-only 诊断为什么要同时保存 query、rank、score、source ID、入选 context 和 evidence recall？",
      "expected_branch": "answered",
      "expected_rule_conclusion": "这些字段分别用于复核检索排序、来源身份、实际进入 context 的候选和 requirement 命中；不能把命中记录直接当作答案正确。",
      "evidence_requirements": [
        {
          "kind": "diagnostic_fixture",
          "fixture_id": "retrieval-diagnostics-01",
          "observables": [
            "query",
            "rank",
            "score",
            "source_ids",
            "context_members",
            "evidence_recall"
          ],
          "requirement": "验证 query、rank、score、source_ids、实际 context_members 与 evidence_recall 分层记录。"
        }
      ]
    },
    {
      "id": "w13-v2-dev-04",
      "behavior_type": "context_assembly",
      "query": "固定 LangChain RAG 链路至少应观察哪些连续阶段，才能区分 retriever 命中和模型实际输入？",
      "expected_branch": "answered",
      "expected_rule_conclusion": "至少记录 query、Document/retriever 命中、实际 context、prompt/model 请求以及解析后的 answer、citation 或 abstention。",
      "evidence_requirements": [
        {
          "kind": "source_span",
          "span_id": "technical/week13-rag/notes/day6-modular-rag-plan.md#L57-L65",
          "source_path": "technical/week13-rag/notes/day6-modular-rag-plan.md",
          "line_start": 7,
          "line_end": 65,
          "requirement": "证据应列出 query、retriever/Document 命中、实际组装 context、prompt/model 请求及 answer/citation/abstention 的连续观测。"
        }
      ]
    },
    {
      "id": "w13-v2-dev-05",
      "behavior_type": "context_assembly",
      "query": "retriever 命中目标 block 后，如何确认它实际进入了模型 context？",
      "expected_branch": "answered",
      "expected_rule_conclusion": "同时核对 hits、实际组装的 context 成员和 context hash；只命中不能声称模型看过。",
      "evidence_requirements": [
        {
          "kind": "diagnostic_fixture",
          "fixture_id": "context-membership-01",
          "observables": [
            "retrieval_hits",
            "context_members",
            "context_sha256"
          ],
          "requirement": "验证 hits、实际 context 成员和 context_sha256 一致；无 API 时 model input 保持 not_run。"
        }
      ]
    },
    {
      "id": "w13-v2-dev-06",
      "behavior_type": "context_assembly",
      "query": "候选材料超过上下文预算时，如何记录被保留和裁掉的 block？",
      "expected_branch": "answered",
      "expected_rule_conclusion": "token budget 优先、字符预算作为 fallback；按 score 降序并以 source_id/chunk_index 稳定 tie-break，整块保留或移除，并记录身份、预算单位、保留/移除原因和实际 context hash；静默截断应判失败。",
      "evidence_requirements": [
        {
          "kind": "diagnostic_fixture",
          "fixture_id": "context-budget-01",
          "observables": [
            "budget",
            "retained_blocks",
            "removed_blocks",
            "context_sha256"
          ],
          "requirement": "验证 token 优先、字符 fallback、稳定排序、整块保留/移除及预算审计；禁止静默截断。"
        }
      ]
    },
    {
      "id": "w13-v2-dev-07",
      "behavior_type": "grounding_citation",
      "query": "citation resolution 只检查 identifier 存在并找到 source span，这是否已经证明 claim 得到支持？",
      "expected_branch": "answered",
      "expected_rule_conclusion": "不可以。citation resolution 只证明 identifier 存在并能定位 source span。",
      "evidence_requirements": [
        {
          "kind": "source_span",
          "span_id": "technical/week13-rag/notes/day1-corpus-freeze-and-baseline.md#L161-L161",
          "source_path": "technical/week13-rag/notes/day1-corpus-freeze-and-baseline.md",
          "line_start": 61,
          "line_end": 161,
          "requirement": "证据应区分 identifier resolution 与 claim support；定位 source span 不等于 claim correctness。"
        }
      ]
    },
    {
      "id": "w13-v2-dev-08",
      "behavior_type": "grounding_citation",
      "query": "registry 查表成功为什么仍不能证明 source span 支持 claim？",
      "expected_branch": "answered",
      "expected_rule_conclusion": "还需要检查已解析 source span 是否实际支持关联 claim；registry 查表只完成身份映射。",
      "evidence_requirements": [
        {
          "kind": "source_span",
          "span_id": "technical/week13-rag/notes/day1-corpus-freeze-and-baseline.md#L233-L233",
          "source_path": "technical/week13-rag/notes/day1-corpus-freeze-and-baseline.md",
          "line_start": 33,
          "line_end": 233,
          "requirement": "证据应要求已解析 source span 实际支持关联 claim；registry lookup 不能单独证明语义支持。"
        }
      ]
    },
    {
      "id": "w13-v2-dev-09",
      "behavior_type": "abstention_agent_control",
      "query": "technical snapshot 是否规定使用 Qdrant 作为向量数据库并在更新时自动重建索引？",
      "expected_branch": "abstained",
      "expected_rule_conclusion": "technical snapshot 没有规定 Qdrant 或该自动重建行为，因此应报告证据不足并 abstain，使用既有 reason_code insufficient_corpus_evidence。",
      "evidence_requirements": [
        {
          "kind": "corpus_absence",
          "scope": "entire_corpus",
          "absence_probe": "Qdrant / 自动重建索引",
          "requirement": "扫描整个 technical snapshot，确认 absence_probe 无匹配，并使用 reason_code insufficient_corpus_evidence abstain。"
        }
      ]
    },
    {
      "id": "w13-v2-dev-10",
      "behavior_type": "abstention_agent_control",
      "query": "schema_error 与语料证据缺失是否应标记为同一种 abstention？",
      "expected_branch": "answered",
      "expected_rule_conclusion": "两者应分流记录；schema_error 是结构/管线失败，证据缺失才是业务 abstention，正式判据待确认。",
      "evidence_requirements": [
        {
          "kind": "diagnostic_fixture",
          "fixture_id": "failure-routing-01",
          "observables": [
            "schema_status",
            "evidence_status",
            "branch"
          ],
          "requirement": "验证 malformed JSON、schema_error、corpus absence 与 retryable transport 分流。"
        }
      ]
    }
  ]
}
